{
  "$schema":"https://json-schema.org/draft/2020-12/schema","$id":"https://cloverapps.ai/schemas/launch-studio/0.1.0/launch-session-index.schema.json","title":"Launch Studio candidate index","type":"object","additionalProperties":false,
  "required":["documentType","schemaVersion","indexId","status","createdAt","previousIndexPath","previousIndexHash","engine","profileCatalog","profiles","schemas","syntheticSession","sourceBoundary","rawPrivateDataAllowedInCore","personalChatGptMemoryIsSharedTruth","standingConsequentialAuthority","entries","indexHash"],
  "properties":{"documentType":{"const":"clover-launch-studio-index"},"schemaVersion":{"const":"0.1.0"},"indexId":{"$ref":"common.schema.json#/$defs/id"},"status":{"const":"candidate-unmerged"},"createdAt":{"$ref":"common.schema.json#/$defs/timestamp"},"previousIndexPath":{"type":["string","null"]},"previousIndexHash":{"$ref":"common.schema.json#/$defs/nullableHash"},"engine":{"type":"object","additionalProperties":false,"required":["runtimeVersion","canonicalization","hashAlgorithm","stateCount","runtimeModules","coreDependencies"],"properties":{"runtimeVersion":{"const":"0.1.0"},"canonicalization":{"const":"RFC8785-JCS"},"hashAlgorithm":{"const":"sha256"},"stateCount":{"const":29},"runtimeModules":{"type":"array","minItems":4,"maxItems":4,"items":{"$ref":"#/$defs/sourceFile"}},"coreDependencies":{"type":"array","minItems":4,"maxItems":4,"items":{"$ref":"#/$defs/sourceFile"}}}},"profileCatalog":{"$ref":"#/$defs/sourceFile"},"profiles":{"$ref":"common.schema.json#/$defs/stringArray"},"schemas":{"type":"array","minItems":25,"items":{"$ref":"#/$defs/sourceFile"}},"syntheticSession":{"type":"object","additionalProperties":false,"required":["sessionId","finalState","replayReceiptPath","reportPath"],"properties":{"sessionId":{"$ref":"common.schema.json#/$defs/id"},"finalState":{"const":"held"},"replayReceiptPath":{"type":"string","minLength":1},"reportPath":{"type":"string","minLength":1}}},"sourceBoundary":{"$ref":"common.schema.json#/$defs/stringArray"},"rawPrivateDataAllowedInCore":{"const":false},"personalChatGptMemoryIsSharedTruth":{"const":false},"standingConsequentialAuthority":{"const":false},"entries":{"type":"array","minItems":1,"items":{"type":"object","additionalProperties":false,"required":["sequence","recordedAt","sessionId","fixturePath","fixtureHash","eventStreamPath","eventStreamHash","finalStatePath","finalStateHash","exportManifestPath","exportManifestHash","restorationReceiptPath","restorationReceiptHash","timelinePath","timelineHash","reportPath","reportHash","replayReceiptPath","replayReceiptHash","status"],"properties":{"sequence":{"type":"integer","minimum":1},"recordedAt":{"$ref":"common.schema.json#/$defs/timestamp"},"sessionId":{"$ref":"common.schema.json#/$defs/id"},"fixturePath":{"type":"string","minLength":1},"fixtureHash":{"$ref":"common.schema.json#/$defs/hash"},"eventStreamPath":{"type":"string","minLength":1},"eventStreamHash":{"$ref":"common.schema.json#/$defs/hash"},"finalStatePath":{"type":"string","minLength":1},"finalStateHash":{"$ref":"common.schema.json#/$defs/hash"},"exportManifestPath":{"type":"string","minLength":1},"exportManifestHash":{"$ref":"common.schema.json#/$defs/hash"},"restorationReceiptPath":{"type":"string","minLength":1},"restorationReceiptHash":{"$ref":"common.schema.json#/$defs/hash"},"timelinePath":{"type":"string","minLength":1},"timelineHash":{"$ref":"common.schema.json#/$defs/hash"},"reportPath":{"type":"string","minLength":1},"reportHash":{"$ref":"common.schema.json#/$defs/hash"},"replayReceiptPath":{"type":"string","minLength":1},"replayReceiptHash":{"$ref":"common.schema.json#/$defs/hash"},"status":{"const":"held-awaiting-real-execution-authority"}}}},"indexHash":{"$ref":"common.schema.json#/$defs/hash"}},
  "$defs":{"sourceFile":{"type":"object","additionalProperties":false,"required":["path","sha256"],"properties":{"path":{"type":"string","minLength":1},"sha256":{"$ref":"common.schema.json#/$defs/hash"}}}}
}
