{"createdAt":"2026-08-23T12:23:00.000Z","documentType":"clover-launch-studio-index","engine":{"canonicalization":"RFC8785-JCS","coreDependencies":[{"path":"portfolio/core/lib/artifact-store.mjs","sha256":"4b98a7bf34307696865dc0d2685838ebd59b20853b263c6a5f080f4271269adf"},{"path":"portfolio/core/lib/canonical-json.mjs","sha256":"108dbb9746d53082fdfe30a354ccc04b7e3be62dd85a7d4de4e0d1c8e0f61602"},{"path":"portfolio/core/lib/handoff-ledger.mjs","sha256":"e169202b2d750fb79b5a76a7d9e67094e5cb8035cca6db9617cd0b2058837dc0"},{"path":"portfolio/core/lib/validators.mjs","sha256":"33578c04676e10729852f84bc58c4efa0ea17a4b6d4ff726c3dfd88495c55d3b"}],"hashAlgorithm":"sha256","runtimeModules":[{"path":"portfolio/core/launch-studio/versions/0.1.0/runtime/contracts.mjs","sha256":"9d23f5cfce001e28fa86adce8942638cbb8dde6f4dd942d6509fcd0c0c84a66d"},{"path":"portfolio/core/launch-studio/versions/0.1.0/runtime/replay.mjs","sha256":"a7ed5af52c3ad7c3659805ad6d1f08729bf91c9c72a7ca95a8c3fdb37cd76546"},{"path":"portfolio/core/launch-studio/versions/0.1.0/runtime/session-archive.mjs","sha256":"e0c43b32ce02234f75798e1a0e5a64f75dc1bd01b3654cfe9229b281a6cd92a1"},{"path":"portfolio/core/launch-studio/versions/0.1.0/runtime/session-engine.mjs","sha256":"e84f368e6d2cac62764ff216de0c5cd67d9e257e4f229cc2434a0db55cc00fd6"}],"runtimeVersion":"0.1.0","stateCount":29},"entries":[{"eventStreamHash":"4f6bdc17a46ababb808142811a3df46b620d1836402fc4c65ef7fad7e4d0db6b","eventStreamPath":"portfolio/core/launch-studio/versions/0.1.0/synthetic/launch-session-events.jsonl","exportManifestHash":"5c85c13c6ba5b77539a57558cc4c761b607b8fcbb8667114033140463995f114","exportManifestPath":"portfolio/core/launch-studio/versions/0.1.0/synthetic/export-manifest.json","finalStateHash":"4dc50620bc7de31b2e51014ef94d7679e62ed61cf8a3c7d08c34b64b95bb8b15","finalStatePath":"portfolio/core/launch-studio/versions/0.1.0/synthetic/launch-session-final.json","fixtureHash":"34784e540036b842ee06daad4525f356eef87b416915210a2ac72163e86933b1","fixturePath":"portfolio/core/launch-studio/versions/0.1.0/synthetic/owner-only-retreat-session.json","recordedAt":"2026-08-23T12:23:00.000Z","replayReceiptHash":"eb5256500355aa2df29a7d4a02c5d76e4b8a6436824b511cdb69a5ee51406571","replayReceiptPath":"portfolio/core/launch-studio/versions/0.1.0/synthetic/replay-receipt.json","reportHash":"d3497646c69ea24fe95dba4a5a4566c0f16ec837d1b254e0dfa51d275c773edd","reportPath":"portfolio/core/launch-studio/versions/0.1.0/synthetic/SYNTHETIC_SESSION_REPORT.md","restorationReceiptHash":"69ef0523fe6be2be8fa4f98770a5e810e6f80cc7aac6a4b66f95d1bdd18b7ccc","restorationReceiptPath":"portfolio/core/launch-studio/versions/0.1.0/synthetic/restoration-receipt.json","sequence":1,"sessionId":"launch_session_synthetic_owner_001","status":"held-awaiting-real-execution-authority","timelineHash":"e38092d1e36e40503b214e72d99068afe8bd261a647b7f5ed812d5efbfd02426","timelinePath":"portfolio/core/launch-studio/versions/0.1.0/synthetic/material-progress-timeline.jsonl"}],"indexHash":"97febc922dc70fca6e488d08cd83f8d6e06ca86de79b3732053e59173e68ee89","indexId":"launch_studio_index_0001","personalChatGptMemoryIsSharedTruth":false,"previousIndexHash":null,"previousIndexPath":null,"profileCatalog":{"path":"portfolio/core/launch-studio/versions/0.1.0/profiles/launch-profiles.json","sha256":"d72154e7610b7cce26ee9d61a8533509ecbea0fc025cfa78b914d0509e4ae6d4"},"profiles":["Idea","Build","Repair","Release","Improvement","Strategy","Collaboration"],"rawPrivateDataAllowedInCore":false,"schemaVersion":"0.1.0","schemas":[{"path":"portfolio/core/launch-studio/versions/0.1.0/schemas/acceptance-contract.schema.json","sha256":"be8bc26ebf8f5b8dac58a5191c1fd9b27ccb2d7ff28e8186b1ad8386ef3507cd"},{"path":"portfolio/core/launch-studio/versions/0.1.0/schemas/authority-reference.schema.json","sha256":"b71048e3b21833c6ae7fd246f85a27b3f76b13a36e344adb3ef90541b0482cb2"},{"path":"portfolio/core/launch-studio/versions/0.1.0/schemas/build-charter.schema.json","sha256":"522bfa2bd3eee586837fa38166c4e3362ab672100242e3022adccef9f7e322fc"},{"path":"portfolio/core/launch-studio/versions/0.1.0/schemas/collaboration-proposal.schema.json","sha256":"1a9e5f66b5cf41720f1ea78204b407878b92166d979b2bb74494ab1a58a8d1e3"},{"path":"portfolio/core/launch-studio/versions/0.1.0/schemas/common.schema.json","sha256":"91f07ea6fca9d8144fce3289bfa43e7d5eeb93326c2d3968f44a17e0603546e0"},{"path":"portfolio/core/launch-studio/versions/0.1.0/schemas/executor-progress-event.schema.json","sha256":"068c796fbd2cc4b9a55d5c29b8d11d181498c367e2d798cdde8df7b2d444811e"},{"path":"portfolio/core/launch-studio/versions/0.1.0/schemas/executor-work-order.schema.json","sha256":"cff48cddcb9238193a165b30805fbc0440bf43b5ed3c05251d83c49c3b1e3e2d"},{"path":"portfolio/core/launch-studio/versions/0.1.0/schemas/export-manifest.schema.json","sha256":"bdffa82c2ec37eca1a15ff72c3626a781ed44822830e995ef389ec1bf6d8080d"},{"path":"portfolio/core/launch-studio/versions/0.1.0/schemas/fruit-observation.schema.json","sha256":"50fa3330661179796c86db7c7325b0764b97de75a2617b9a2fc2349d16fcd874"},{"path":"portfolio/core/launch-studio/versions/0.1.0/schemas/impact-scan.schema.json","sha256":"7ae24bbcf71c1a15b30c19450bab874497aa87fba49b765183e37b0491b7604b"},{"path":"portfolio/core/launch-studio/versions/0.1.0/schemas/launch-context-pack.schema.json","sha256":"38a576ff6ba4dfef2f891ea5c3e716218692376d8228b1b225cb2f784fcd7259"},{"path":"portfolio/core/launch-studio/versions/0.1.0/schemas/launch-profile.schema.json","sha256":"c5aff4984eac0c2c8b2105ed986bb3d2e92e62c1f8644e80d6b7813669cdf5e6"},{"path":"portfolio/core/launch-studio/versions/0.1.0/schemas/launch-session-event.schema.json","sha256":"0245f4ef6188270838715c9045670dab5722318ca81a8e85352f053097eaaf6e"},{"path":"portfolio/core/launch-studio/versions/0.1.0/schemas/launch-session-index.schema.json","sha256":"0eda0a38b9b91c6009aa0072f0fe3e2a7d1c8a0fd073440aa829571a1cd10853"},{"path":"portfolio/core/launch-studio/versions/0.1.0/schemas/launch-session.schema.json","sha256":"7ee6db7263536d595e74318a83c2bcdd5d8a1e7475eeda2eeb7e089f8b8ddbd6"},{"path":"portfolio/core/launch-studio/versions/0.1.0/schemas/offboarding.schema.json","sha256":"1a15e17da65f3ca291027ab3aeff9cdef3103822715002d0e0e8c8d150f196da"},{"path":"portfolio/core/launch-studio/versions/0.1.0/schemas/owner-event.schema.json","sha256":"c8a5785f42b7952879f093adac6b529bcd59649f3c2e389ac116f08d585485d1"},{"path":"portfolio/core/launch-studio/versions/0.1.0/schemas/participant-consent.schema.json","sha256":"bdc444fba491dc46075c6b41ea1725d99f30e976d57ff692814d59035acf3c4c"},{"path":"portfolio/core/launch-studio/versions/0.1.0/schemas/participant-role.schema.json","sha256":"8495c09f16287f968b484c2c9628e8198f09819221531e7aa2384d531cd7f265"},{"path":"portfolio/core/launch-studio/versions/0.1.0/schemas/preview-receipt.schema.json","sha256":"e09b1cb7abe010973692e2b7e4bef04bbf5edcbdc9c585e4ca54dac9787f8118"},{"path":"portfolio/core/launch-studio/versions/0.1.0/schemas/project-launch-capsule.schema.json","sha256":"f0adac5452890f1210647dc03d068f8a0d756cdfb1a080f6b0f9d700532ef738"},{"path":"portfolio/core/launch-studio/versions/0.1.0/schemas/restoration-receipt.schema.json","sha256":"b5e48003f6f5495f6d8198369a07adbbd5ac1fbba24d8c75c115acc31bb0576b"},{"path":"portfolio/core/launch-studio/versions/0.1.0/schemas/revocation.schema.json","sha256":"0c2fbbf689ad5846c028e59e6c41fe061f44ca2452c907d2c829b55472edafb5"},{"path":"portfolio/core/launch-studio/versions/0.1.0/schemas/session-budget.schema.json","sha256":"83d99da26079b98c0aac18a1e9112dd8add3f12d695245955262807906fbe049"},{"path":"portfolio/core/launch-studio/versions/0.1.0/schemas/shared-project-delta.schema.json","sha256":"64c322c5c19ee95a6386370f6a4ec215afe2c18083aaa3f53524f6309c550e82"},{"path":"portfolio/core/launch-studio/versions/0.1.0/schemas/synthetic-replay-receipt.schema.json","sha256":"4dc1f1063802e61732f02f618f893841c9d9dc7b456ae030b4eeb474e8fe8445"},{"path":"portfolio/core/launch-studio/versions/0.1.0/schemas/synthetic-session-fixture.schema.json","sha256":"f4ee0259380c08e3e2d6bfc588a1f169d7c42f68d698b1aa4cb15d5583ef7f62"},{"path":"portfolio/core/launch-studio/versions/0.1.0/schemas/understanding-check.schema.json","sha256":"e590e66b53f3ec8dd2e50957fa6fe76dba66164f1edf3d44575e7a059f6a9ea5"},{"path":"portfolio/core/launch-studio/versions/0.1.0/schemas/understanding-delta.schema.json","sha256":"fef9fe4b402ef129c874b3cc0903b8d09c6341623e42b88adecb4793657dfa23"}],"sourceBoundary":["portfolio/core/launch-studio/**","portfolio/core/test/launch-studio-session-engine.test.mjs"],"standingConsequentialAuthority":false,"status":"candidate-unmerged","syntheticSession":{"finalState":"held","replayReceiptPath":"portfolio/core/launch-studio/versions/0.1.0/synthetic/replay-receipt.json","reportPath":"portfolio/core/launch-studio/versions/0.1.0/synthetic/SYNTHETIC_SESSION_REPORT.md","sessionId":"launch_session_synthetic_owner_001"}}
